CRIM_Phrase_ID,CRIM_Mass_ID,Mass_Section_ID,Section_Phrase_Number,Start_Measure,Stop_Measure,End of section,Text,,,,,,,,
a preciser dans la liste complete!,CRIM_Mass_0002,CRIM_Mass_0002_01,1,1,21,1,Kyrie eleison.,,,,,,,,
,CRIM_Mass_0002,CRIM_Mass_0002_01,2,22,42,2,Christe eleison.,,,,,,,,
,CRIM_Mass_0002,CRIM_Mass_0002_01,3,43,67,3,Kyrie eleison.,,,,,,,,
,CRIM_Mass_0002,CRIM_Mass_0002_02,1,1,9,1,Et in terra pax hominibus bonae voluntatis.,,,,,,,,
,CRIM_Mass_0002,CRIM_Mass_0002_02,2,7,11,1,Laudamus te.,,,,,,,,
,CRIM_Mass_0002,CRIM_Mass_0002_02,3,9,13,1,Benedicimus te.,,,,,,,,
,CRIM_Mass_0002,CRIM_Mass_0002_02,4,12,15,1,Adoramus te.,,,,,,,,
,CRIM_Mass_0002,CRIM_Mass_0002_02,5,14,18,1,Glorificamus te.,,,,,,,,
,CRIM_Mass_0002,CRIM_Mass_0002_02,6,17,28,1,Gratias agimus tibi propter magnam gloriam tuam.,,,,,,,,
,CRIM_Mass_0002,CRIM_Mass_0002_02,7,27,37,1,"Domine Deus, Rex caelestis, Deus Pater omnipotens.",,,,,,,,
,CRIM_Mass_0002,CRIM_Mass_0002_02,8,34,47,1,Domine Fili unigenite Iesu Christe.,,,,,,,,
,CRIM_Mass_0002,CRIM_Mass_0002_02,9,45,60,1,"Domine Deus, Agnus Dei, Filius Patris.",,,,,,,,
,CRIM_Mass_0002,CRIM_Mass_0002_02,10,61,72,2,"Qui tollis peccata mundi, miserere nobis.",,,,,,,,
,CRIM_Mass_0002,CRIM_Mass_0002_02,11,69,82,2,"Qui tollis peccata mundi, suscipe deprecationem nostram.",,,,,,,,
,CRIM_Mass_0002,CRIM_Mass_0002_02,12,81,89,2,"Qui sedes ad dexteram Patris, miserere nobis.",,,,,,,,
,CRIM_Mass_0002,CRIM_Mass_0002_02,13,88,92,2,Quoniam tu solus sanctus.,,,,,,,,
,CRIM_Mass_0002,CRIM_Mass_0002_02,14,90,95,2,Tu solus Dominus.,,,,,,,,
,CRIM_Mass_0002,CRIM_Mass_0002_02,15,95,104,2,"Tu solus Altissimus, Iesu Christe.",,,,,,,,
,CRIM_Mass_0002,CRIM_Mass_0002_02,16,101,113,2,"Cum Sancto Spiritu, in gloria Dei Patris.",,,,,,,,
,CRIM_Mass_0002,CRIM_Mass_0002_02,17,112,122,2,Amen.,,,,,,,,
,CRIM_Mass_0002,CRIM_Mass_0002_03,1,1,15,1,"Patrem omnipotentem, factorem caeli et terrae, visibilium omnium, et invisibilium.",,,,,,,,
,CRIM_Mass_0002,CRIM_Mass_0002_03,2,13,23,1,"Et in unum Dominum Iesum Christum, Filium Dei unigenitum.",,,,,,,,
,CRIM_Mass_0002,CRIM_Mass_0002_03,3,22,30,1,Et ex Patre natum ante omnia saecula.,,,,,,,,
,CRIM_Mass_0002,CRIM_Mass_0002_03,4,28,36,1,"Deum de Deo, lumen de lumine, Deum verum de Deo vero.",,,,,,,,
,CRIM_Mass_0002,CRIM_Mass_0002_03,5,35,43,1,"Genitum, non factum, consubstantialem Patri:",,,,,,,,
,CRIM_Mass_0002,CRIM_Mass_0002_03,6,41,45,1,per quem omnia facta sunt.,,,,,,,,
,CRIM_Mass_0002,CRIM_Mass_0002_03,7,44,57,1,"Qui propter non homines, et propter nostram salutem descendit de caelis.",,,,,,,,
,CRIM_Mass_0002,CRIM_Mass_0002_03,8,54,67,1,Et incarnatus est de Spiritu Sancto ex Maria Virgine:,,,,,,,,
,CRIM_Mass_0002,CRIM_Mass_0002_03,9,67,73,1,Et homo factus est.,,,,,,,,
,CRIM_Mass_0002,CRIM_Mass_0002_03,10,74,80,2,Crucifixus etiam pro nobis: ,,,,,,,,
,CRIM_Mass_0002,CRIM_Mass_0002_03,11,80,88,2,"sub Pontio Pilato passus, et sepultus est.",,,,,,,,
,CRIM_Mass_0002,CRIM_Mass_0002_03,12,86,94,2,"Et resurrexit tertia die, secundum Scripturas.",,,,,,,,
,CRIM_Mass_0002,CRIM_Mass_0002_03,13,92,98,2,Et ascendit in caelum:,,,,,,,,
,CRIM_Mass_0002,CRIM_Mass_0002_03,14,96,102,2,sedet ad dexteram Patris.,,,,,,,,
,CRIM_Mass_0002,CRIM_Mass_0002_03,15,103,111,3,"Et iterum venturus est cum gloria, iudicare vivos et mortuos:",,,,,,,,
,CRIM_Mass_0002,CRIM_Mass_0002_03,16,110,116,3,cuius regni non erit finis.,,,,,,,,
,CRIM_Mass_0002,CRIM_Mass_0002_03,17,115,122,3,"Et in Spiritum Sanctum, Dominum, et vivificantem:",,,,,,,,
,CRIM_Mass_0002,CRIM_Mass_0002_03,18,120,124,3,qui ex Patre Filioque procedit.,,,,,,,,
,CRIM_Mass_0002,CRIM_Mass_0002_03,19,123,130,3,"Qui cum Patre et Filio simul adoratur, et conglorificatur: ",,,,,,,,
,CRIM_Mass_0002,CRIM_Mass_0002_03,20,128,136,3,qui locutus est per Prophetas.,,,,,,,,
,CRIM_Mass_0002,CRIM_Mass_0002_03,21,135,147,3,Et unam sanctam catholicam et apostolicam Ecclesiam.,,,,,,,,
,CRIM_Mass_0002,CRIM_Mass_0002_03,22,146,158,3,Confiteor unum baptisma in remissionem peccatorum.,,,,,,,,
,CRIM_Mass_0002,CRIM_Mass_0002_03,23,157,169,3,Et expecto resurrectionem mortuorum.,,,,,,,,
,CRIM_Mass_0002,CRIM_Mass_0002_03,24,168,174,3,Et vitam venturi saeculi.,,,,,,,,
,CRIM_Mass_0002,CRIM_Mass_0002_03,25,173,179,3,Amen.,,,,,,,,
,CRIM_Mass_0002,CRIM_Mass_0002_04,1,1,25,1,Sanctus Dominus Deus Sabaoth.,,,,,,,,
,CRIM_Mass_0002,CRIM_Mass_0002_04,2,26,46,2,Pleni sunt caeli et terra gloria tua.,,,,,,,,
,CRIM_Mass_0002,CRIM_Mass_0002_04,3,47,73,3,Hosanna in excelsis.,,,,,,,,
,CRIM_Mass_0002,CRIM_Mass_0002_04,4,74,104,4,Benedictus qui venit in nomine Domini.,,,,,,,,
,CRIM_Mass_0002,CRIM_Mass_0002_05,1,1,22,1,"Agnus Dei, qui tollis peccata mundi: ",,,,,,,,
,CRIM_Mass_0002,CRIM_Mass_0002_05,2,20,33,1,miserere nobis.,,,,,,,,
,,,,,,,"Agnus Dei, qui tollis peccata mundi: ",,,,,,,,
,,,,,,,miserere nobis.,,,,,,,,
,CRIM_Mass_0002,CRIM_Mass_0002_05,3,34,62,2,"Agnus Dei, qui tollis peccata mundi: ",,,,,,,,
,CRIM_Mass_0002,CRIM_Mass_0002_05,4,58,72,2,dona nobis pacem.,,,,,,,,