CRIM_Phrase_ID,CRIM_Mass_ID,Mass_Section_ID,Section_Phrase_Number,Start_Measure,Stop_Measure,End of section,Text,,,,,,,,
a preciser dans la liste complete!,CRIM_Mass_0005,CRIM_Mass_0005_1,1,1,36,1,Kyrie eleison.,,,,,,,,
,CRIM_Mass_0005,CRIM_Mass_0005_1,2,37,64,2,Christe eleison.,,,,,,,,
,CRIM_Mass_0005,CRIM_Mass_0005_1,3,65,96,3,Kyrie eleison.,,,,,,,,
,CRIM_Mass_0005,CRIM_Mass_0005_2,1,1,13,1,Et in terra pax hominibus bonae voluntatis.,,,,,,,,
,CRIM_Mass_0005,CRIM_Mass_0005_2,2,12,14,1,Laudamus te.,,,,,,,,
,CRIM_Mass_0005,CRIM_Mass_0005_2,3,14,16,1,Benedicimus te.,,,,,,,,
,CRIM_Mass_0005,CRIM_Mass_0005_2,4,16,22,1,Adoramus te.,,,,,,,,
,CRIM_Mass_0005,CRIM_Mass_0005_2,5,22,31,1,Glorificamus te.,,,,,,,,
,CRIM_Mass_0005,CRIM_Mass_0005_2,6,31,40,1,Gratias agimus tibi propter magnam gloriam tuam.,,,,,,,,
,CRIM_Mass_0005,CRIM_Mass_0005_2,7,38,48,1,"Domine Deus, Rex caelestis, Deus Pater omnipotens.",,,,,,,,
,CRIM_Mass_0005,CRIM_Mass_0005_2,8,48,63,1,Domine Fili unigenite Iesu Christe.,,,,,,,,
,CRIM_Mass_0005,CRIM_Mass_0005_2,9,64,87,2,"Domine Deus, Agnus Dei, Filius Patris.",,,,,,,,
,CRIM_Mass_0005,CRIM_Mass_0005_2,10,88,100,3,"Qui tollis peccata mundi, miserere nobis.",,,,,,,,
,CRIM_Mass_0005,CRIM_Mass_0005_2,11,99,116,3,"Qui tollis peccata mundi, suscipe deprecationem nostram.",,,,,,,,
,CRIM_Mass_0005,CRIM_Mass_0005_2,12,116,124,3,"Qui sedes ad dexteram Patris, miserere nobis.",,,,,,,,
,CRIM_Mass_0005,CRIM_Mass_0005_2,13,124,129,3,Quoniam tu solus sanctus.,,,,,,,,
,CRIM_Mass_0005,CRIM_Mass_0005_2,14,127,132,3,Tu solus Dominus.,,,,,,,,
,CRIM_Mass_0005,CRIM_Mass_0005_2,15,133,142,3,"Tu solus Altissimus, Iesu Christe.",,,,,,,,
,CRIM_Mass_0005,CRIM_Mass_0005_2,16,143,152,3,"Cum Sancto Spiritu, in gloria Dei Patris.",,,,,,,,
,CRIM_Mass_0005,CRIM_Mass_0005_2,17,152,163,3,Amen.,,,,,,,,
,CRIM_Mass_0005,CRIM_Mass_0005_3,1,1,20,1,"Patrem omnipotentem, factorem caeli et terrae, visibilium omnium, et invisibilium.",,,,,,,,
,CRIM_Mass_0005,CRIM_Mass_0005_3,2,20,35,1,"Et in unum Dominum Iesum Christum, Filium Dei unigenitum.",,,,,,,,
,CRIM_Mass_0005,CRIM_Mass_0005_3,3,35,47,1,Et ex Patre natum ante omnia saecula.,,,,,,,,
,CRIM_Mass_0005,CRIM_Mass_0005_3,4,45,59,1,"Deum de Deo, lumen de lumine, Deum verum de Deo vero.",,,,,,,,
,CRIM_Mass_0005,CRIM_Mass_0005_3,5,58,69,1,"Genitum, non factum, consubstantialem Patri: ",,,,,,,,
,CRIM_Mass_0005,CRIM_Mass_0005_3,6,69,74,1,per quem omnia facta sunt.,,,,,,,,
,CRIM_Mass_0005,CRIM_Mass_0005_3,7,75,95,1,"Qui propter non homines, et propter nostram salutem descendit de caelis.",,,,,,,,
,CRIM_Mass_0005,CRIM_Mass_0005_3,8,96,110,2,Et incarnatus est de Spiritu Sancto ex Maria Virgine:,,,,,,,,
,CRIM_Mass_0005,CRIM_Mass_0005_3,9,109,119,2,Et homo factus est.,,,,,,,,
,CRIM_Mass_0005,CRIM_Mass_0005_3,10,120,128,3,Crucifixus etiam pro nobis:,,,,,,,,
,CRIM_Mass_0005,CRIM_Mass_0005_3,11,126,141,3,"sub Pontio Pilato passus, et sepultus est.",,,,,,,,
,CRIM_Mass_0005,CRIM_Mass_0005_3,12,142,160,4,"Et resurrexit tertia die, secundum Scripturas.",,,,,,,,
,CRIM_Mass_0005,CRIM_Mass_0005_3,13,161,164,4,Et ascendit in caelum: ,,,,,,,,
,CRIM_Mass_0005,CRIM_Mass_0005_3,14,164,168,4,sedet ad dexteram Patris.,,,,,,,,
,CRIM_Mass_0005,CRIM_Mass_0005_3,15,169,195,5,"Et iterum venturus est cum gloria, iudicare vivos et mortuos:",,,,,,,,
,CRIM_Mass_0005,CRIM_Mass_0005_3,16,191,200,5,cuius regni non erit finis.,,,,,,,,
,CRIM_Mass_0005,CRIM_Mass_0005_3,17,201,213,6,"Et in Spiritum Sanctum, Dominum, et vivificantem: ",,,,,,,,
,CRIM_Mass_0005,CRIM_Mass_0005_3,18,213,219,6,qui ex Patre Filioque procedit.,,,,,,,,
,CRIM_Mass_0005,CRIM_Mass_0005_3,19,219,228,6,"Qui cum Patre et Filio simul adoratur, et conglorificatur:",,,,,,,,
,CRIM_Mass_0005,CRIM_Mass_0005_3,20,225,235,6,qui locutus est per Prophetas.,,,,,,,,
,CRIM_Mass_0005,CRIM_Mass_0005_3,21,235,248,6,Et unam sanctam catholicam et apostolicam Ecclesiam.,,,,,,,,
,CRIM_Mass_0005,CRIM_Mass_0005_3,22,248,257,6,Confiteor unum baptisma in remissionem peccatorum.,,,,,,,,
,CRIM_Mass_0005,CRIM_Mass_0005_3,23,258,272,6,Et expecto resurrectionem mortuorum.,,,,,,,,
,CRIM_Mass_0005,CRIM_Mass_0005_3,24,273,279,6,Et vitam venturi saeculi.,,,,,,,,
,CRIM_Mass_0005,CRIM_Mass_0005_3,25,277,283,6,Amen.,,,,,,,,
,CRIM_Mass_0005,CRIM_Mass_0005_4,1,1,37,1,Sanctus Dominus Deus Sabaoth.,,,,,,,,
,CRIM_Mass_0005,CRIM_Mass_0005_4,2,38,74,2,Pleni sunt caeli et terra gloria tua.,,,,,,,,
,CRIM_Mass_0005,CRIM_Mass_0005_4,3,75,95,3,Hosanna in excelsis.,,,,,,,,
,CRIM_Mass_0005,CRIM_Mass_0005_4,4,96,148,4,Benedictus qui venit in nomine Domini.,,,,,,,,
,CRIM_Mass_0005,CRIM_Mass_0005_5,1,1,25,1,"Agnus Dei, qui tollis peccata mundi: ",,,,,,,,
,CRIM_Mass_0005,CRIM_Mass_0005_5,2,16,52,1,miserere nobis.,,,,,,,,
,CRIM_Mass_0005,CRIM_Mass_0005_5,3,53,77,2,"Agnus Dei, qui tollis peccata mundi: ",,,,,,,,
,CRIM_Mass_0005,CRIM_Mass_0005_5,4,75,89,2,miserere nobis.,,,,,,,,
,,,,,,,"Agnus Dei, qui tollis peccata mundi: ",,,,,,,,
,,,,,,,dona nobis pacem.,,,,,,,,